speaker,timestamp,End Time,words,tags
Jennifer Ladino,[00:25:38:14],00:26:08:16,"I mean, I think in the early years of the program when students hiked in, they had a much easier time adapting to life there. Some students have never backpacked, for example, never carried a backpack. And so having that opportunity to carry some of their stuff and obviously not all of it, and to kind of meander their way to, you know, to the heart of the wilderness was a much different and easier way to acclimatize.",wilderness
Jennifer Ladino,[00:26:08:18],00:26:33:18,"And sure, I mean, to depending on people's experience levels and what they expected coming into this program, some were more immediately at home than others. It might take some time. Yeah. I mean, in some people, you know, anxiety, I'm sure about like the openness, you know, it's almost a kind of agoraphobia to feel like you're so remote and it's so open and help as far away.",wilderness
Jennifer Ladino,[00:26:33:19],00:26:54:15,"Like that's part of that's one definition of agoraphobia. It's like feeling like you're so in such a remote, open space that you're on your own and you kind of are like, there are days when the planes can't fly because the weather is too bad and you just hope you don't break something or get really sick during one of those weather periods.",
Jennifer Ladino,[00:26:54:17],00:27:24:00,"So it's yeah, I think that's part of the excitement for some people is that you, you know, part of being in a wilderness area is accepting a little bit of risk. That's part of the maybe adventure that some recreational is look for. You know, the more thrill seeking folks the campus itself, the Taylor Wilderness research Station itself feels very comfortable to some students, to comfortable like they wanted it to be rougher, like they didn't want to stay in a nice cabin.",wilderness
Jennifer Ladino,[00:27:24:02],00:27:49:08,"Right. And so after the first few years, with the help of the DeVlieg Foundation, we were able to put together some wall tents. So now the students live in wall tents, which they share with two or three other students. And so those are much more humble. You know, they do have ways of heating. I think they've got a little wood stoves in there where they can heat it when it gets really cold, but they're nice.",community
Jennifer Ladino,[00:27:49:09],00:28:10:11,"So you can hear the creak still that you feel a little bit more like you're not in a house. So that's I guess that's a different way of thinking about home, isn't it? Like feeling a level of comfort and at home in a in a building. So if you take the building away, then you're sort of a little bit more at home in the wilderness, you can say.",community
Jennifer Ladino,[00:28:10:13],00:28:34:10,"But I think for me, I had spent a lot of years as a park ranger and it felt very familiar to be on a small piece of land with very old buildings and a community of workers and learners that you sort of are sharing a mission with. To me, that was what I did for 13 summers with the National Park Service.",community
Jennifer Ladino,[00:28:34:10],00:29:02:11,"And so I wasn't disoriented or ill at ease upon entering. But yeah, it would be different for for different people, for sure. It's I mean, the word this reminds me a little bit of the word bewilder or bewilderment, which is all about feeling lost or disoriented and it comes from the verb wilder, which used to mean to like, lead somebody astray or to like, be led astray.",
Jennifer Ladino,[00:29:02:13],00:29:24:01,"So that's really interesting to think about how wilderness can be disorienting, unsettling, confounding kind of experience. And I think some students wish it was more like that, like they needed a little more of that risk. And then for others, it was it was a lot all at once. Yeah.",wilderness
Jack Kredell,[00:29:24:03],00:29:32:20,"Yeah. I mean, you can implying that that's a vital part of Taylor's educational platform and environment.",
Jennifer Ladino,[00:29:32:22],00:29:54:08,"Yeah, it is. Absolutely. And I think flexibility, you know, it's one of those areas where, like I was saying, with planes and weather systems, there is a lot of uncertainty even now, even as as civilized as we've made it and safe as we've made it. Of course, safety is a huge priority for the program. It still has elements of the unknown, the unexpected.",routine
Jennifer Ladino,[00:29:54:09],00:30:22:09,"You might have to shift gears partway through a lesson if you know a rainstorm comes. Once we had a students stop class because it was raining outside and she wanted to just listen to that for a while and and like be present with the storm. So we stopped class and did that. I think it forces you to have a kind of flexible teaching style, which always was my preferred mode anyway, but even more so in a wilderness area.",routine
Jennifer Ladino,[00:30:22:11],00:30:47:07,"So yeah, uncertainty, flexibility, a little bit of confounding. Yes, I guess. And if you're out, you know, on a trail or off a trail and sort of exploring, there's plenty of opportunity for that sort of thing. Just right off the right off the campus. We got Pioneer Creek, for example. My colleague Scott Slovic has a great essay about getting that lost, but going on a very epic hike with a student at Pioneer Creek.",water
Jennifer Ladino,[00:30:47:07],00:30:57:05,"So you should ask him about that. He wrote about it in this book that I'm holding.Yes, Idaho Wilderness Considered. You should pick it up. It's great book. 2016.",
Jack Kredell,[00:30:57:06],00:30:58:22,Yeah I know.,
Jennifer Ladino,[00:30:59:00],00:31:00:02,I think it's 2016.,
Jack Kredell,[00:31:00:07],00:31:04:14,Who has doing work on Pioneer Creek?,
Jennifer Ladino,[00:31:04:21],00:31:05:06,"no, wait.",
Jack Kredell,[00:31:05:10],00:31:08:05,"Grace. Pervan. Yeah, so. okay.",
Jennifer Ladino,[00:31:08:09],00:31:09:10,"Yeah, yeah.",
Jack Kredell,[00:31:09:12],00:31:11:08,Yeah. She works with Marise.,
Jennifer Ladino,[00:31:11:10],00:31:12:07,Okay.,
Jack Kredell,[00:31:12:09],00:31:15:04,That's very interesting.,
Jennifer Ladino,[00:31:15:06],00:31:44:13,"Yeah, Yeah. Getting lost as, as part of it, I think. And I didn't go on any of the backpacking trips with the students I really wish I had. But you can ask Scott or Adam about that, that experience, you know, and I don't think there were any major losses, although other things exciting things happened. But yeah, yeah. You feel you feel pretty out there.",
Jennifer Ladino,[00:31:44:13],00:32:12:03,"I mean, you are out there, you're far from health services, for example, far from roads. So to me that's a nice feeling. But I think for other people it may not be so nice. And I mean, one of the things people value about wilderness traditionally is just knowing that it's there, whether you can personally go to it or want to go to it or not.",wilderness
Jennifer Ladino,[00:32:12:05],00:32:23:23,"It's an idea. It's a it's a material thing, but it's also an idea. And people like to know that we have wilderness that is there, you know, that means something.",
Jack Kredell,[00:32:24:01],00:32:27:19,"To have the option of discomfort, even if you take it.",
Jennifer Ladino,[00:32:28:01],00:32:33:18,"Yeah, yeah. Knowing that other people are climbing Mount Everest and you don't have to like. Yeah.",
Jack Kredell,[00:32:33:20],00:32:49:15,"Yeah, yeah. I want to work with you far too because I, I want to do it. These are on, on wilderness with you.",
Jennifer Ladino,[00:32:49:17],00:32:53:15,Yeah. I would need to probably prep a bit for that. I No.,
Jack Kredell,[00:32:53:15],00:33:30:17,"No. Europe or No, my, my wheels are spinning but I want to, I want to. Let's just end with, given the value that you outlined for retailers educational prices, what, what you, what would you like to see for Taylor's future?",
Jennifer Ladino,[00:33:30:19],00:33:57:21,"That's a great question. I mean, the semester in the wild program could grow. We've we've never maxed out the number of students that could benefit from it. So one quick answer is just better recruiting. You know, honestly, for that program, I think we could we could do more to get the word out, to tell the story about how unique Semester in the Wild is as a program.",
Jennifer Ladino,[00:33:58:01],00:34:21:11,"We don't want it to get too big. I mean, for me as an educator, like right around a dozen is pretty optimal. But I think we can hold upwards even close to 20. I'm pretty sure I'd have to check that as always, a fine line, right? Because you don't want to argue that we need to get more people into the wilderness because then, you know, at what point does it become overpopulated or does it lose some of that magic character?",wilderness
Jennifer Ladino,[00:34:21:13],00:34:43:17,"But I would love to see more researchers and scholars from all of the disciplines be invited and have opportunities to use that space. Right? We've got the writing in the wild fellowship that our creative writing students get to take advantage of it as an application process. Three of them go every fall, late summer or early fall, and that's cool.",creativity
Jennifer Ladino,[00:34:43:17],00:35:13:06,"So more opportunities like that for for faculty. I'd love to see it be a place for percolating sort of interdisciplinary collaboration. For example, beyond the Semester in the Wild program, you know, there are faculty doing really interesting work on campus that, you know, if we did retreats there, I think, you know, we could make even more progress together in these concentrated bursts of time that are so rare and valuable for for faculty researchers.",
Jennifer Ladino,[00:35:13:08],00:35:41:11,"You know, I don't know how I feel about sort of opening up to broader publics beyond the university, but yeah, I'd have to think about that. But it is such a unique and special place, so I part of you really wants to share it with, with more people, you know, get people out there, but without crossing that line of changing it.",
Jennifer Ladino,[00:35:41:13],00:36:00:18,"But that's a conversation for another time. The tension between change and stasis, that's very much a part of what wilderness is, especially with climate change and impacts of that. I think that's a great note to end on, but.",wilderness
Jack Kredell,[00:36:00:20],00:36:11:09,"I like to have this. I should have warned you, I, I like to have awkward pauses at the ends of ideas. Yeah, I could, I could end videos there.",creativity
Jennifer Ladino,[00:36:11:20],00:36:12:04,yeah.,
Jack Kredell,[00:36:12:04],00:36:13:08,And you like to fill them up.,
Jennifer Ladino,[00:36:13:08],00:36:20:00,I know. Sorry I sort of I've been. I've been doing really well. I thought I normally I do a lot more filling.,
Jack Kredell,[00:36:20:08],00:36:25:02,"that was, We, we have almost 40 minutes right there.",
Jennifer Ladino,[00:36:25:09],00:36:25:20,great.,