speaker,timestamp,End Time,words,tags
Grace Peven,[00:32:51:18],00:33:28:12,"It takes patience and time to be in these places and and just listen to them. When I started this research, I, you know, to come to my current research, I did a lot of reading from other scientists that have studied springs in hydrology. And I thought I knew, okay, here's the question I want to do. And then I when I got out here, I had to shift around my question for what was what I was observing here and what was possible to do also.",creativity
Grace Peven,[00:33:30:00],00:33:40:10,and I think that's really important to just be open minded and curious and be open to being surprised by what you find out here.,creativity
Jack Kredell,[00:33:40:12],00:33:55:13,"Yeah, it sounds like your, your research question evolved out of a kind of immersion in the physical environment, just coming up with it ready made after reading a bunch of articles.",
Grace Peven,[00:33:58:07],00:34:34:22,"Yeah, I think that's, you know, that's part of the scientific method and process is that it starts with an observation and then it leads to a hypothesis or a question. and I think that's, that's really true. I think it has to start with some, some observation. And I think in this type of work in water resources, in natural resources, that has to start with just hiking around and getting out into the environment and looking at something and being like, that's kind of weird or that's interesting.",
Grace Peven,[00:34:34:22],00:35:07:20,"I wonder why that hill looks like that or when or why those trees are there, or why are these springs showing up in this one spot and just asking also really basic questions like that, that and that'll lead you, I think, down, down a rabbit hole of other questions. So starting with like and I think it can be overwhelming to like you look around here and you think like this landscape is so vast and there's so much to cover and so much to, to be curious about.",
Grace Peven,[00:35:07:20],00:35:27:15,"But just starting starting with those really basic questions and being like, I wonder, you know, I wonder why the groundwater is coming up here. I wonder why. Why this is the way it is. And starting there will well lead you will lead you to an interesting place.",water
Jack Kredell,[00:35:27:17],00:35:30:12,Or maybe just I feel like hiking over there.,
Grace Peven,[00:35:31:16],00:35:44:16,"Yeah, exactly. Yeah. Not always having a specific goal or direction to can, can feel nice and just meandering around the woods.",
Jack Kredell,[00:35:47:09],00:35:48:08,batteries going to die.,
Grace Peven,[00:35:48:11],00:35:48:21,Okay.,
Jack Kredell,[00:35:49:01],00:36:01:20,"Have you, have you had any memorable encounters with wildlife while working with springs?",
Grace Peven,[00:36:01:22],00:36:28:14,"I actually haven't. And I think I purposely try to prevent, you know, running into a bear or spooking up wildlife. So, you know, I when I approach a spring, I'm I'm very intentional about it and very cautious to not, you know, spook a bear for my own safety, but also not to stress out the bear because it's probably enjoying a really nice, cool, shady spot at a spring.",
Grace Peven,[00:36:28:14],00:36:47:00,"And, you know, I'm just coming up and ruining its day. So so I try to be intentional about, you know, when I'm walking up and making noise and just approaching it quietly and not stomping into the spring.",
Jack Kredell,[00:36:47:01],00:37:00:15,"Like me, I always burst out laughing, knowing that like the first thing I did was just like, get to the middle of the spring, suck up all the water.",
Grace Peven,[00:37:00:17],00:37:05:10,"So yeah, it's it's life giving. You need it every spring.",
Jack Kredell,[00:37:05:10],00:37:05:19,Mother.,
Grace Peven,[00:37:05:21],00:37:14:13,Yes. Blessings don't include the grass.,
Jack Kredell,[00:37:14:15],00:37:22:05,Do you know where your love of water began?,
Grace Peven,[00:37:25:14],00:38:02:19,"yeah. My parents were rafting guides, in their younger days, and they kind of kept that tradition when I was growing up of going rafting every summer. So I started rafting from a young age with my family on the Salmon River and rivers in Washington and Oregon. and I just, I just loved it. I loved being on the water and the perspective that you get of the landscape when you're floating on a river and like letting the river take you where it wants to take you and kind of working with it.",water
Grace Peven,[00:38:02:21],00:38:41:18,"I loved that aspect of rafting. And we'd also, when we'd get to camp, there would usually be a tributary coming in at the campsite and I would love to just hike up the tributary right in the middle of the creek for hours, just to see, just to see where it went. And it just felt like a different world in there in the water and yeah, I've just always, just always wanted to be around water and studying it and playing in it.",water
Grace Peven,[00:38:44:08],00:38:45:16,yeah.,
Jack Kredell,[00:38:45:18],00:38:58:09,I'm looking for the source. Can you talk about this watershed.,
Grace Peven,[00:38:58:11],00:39:05:10,"About Pioneer? Yeah. yeah, just in general. Like.",
Jack Kredell,[00:39:05:12],00:39:21:04,"Yeah, where it is, like, you could talk about, like, you could, you could describe the, like, the dendrite pioneer to big creek, to the middle fork, to the salmon, to the Columbia.",
Grace Peven,[00:39:21:06],00:39:50:00,"Yeah, Yeah. so pioneer, which is the watershed right behind Taylor Ranch, is a small it's a really small catchment. It's about six square miles, and it dreams. The highest point that it drains from is Dave Lewis Peak at about 9200 feet. so it's a really steep drainage because Taylor where the base of Pioneer where it comes into Big Creek is about 3800 feet.",
Grace Peven,[00:39:50:02],00:40:20:17,"So it's draining, it's draining a lot of elevation from, from the top to the bottom. and it's really steep and rugged, rocky. The diamond fire in 2000 burned pretty hot in this watershed. So you can see down logs everywhere you go. And there's little timber patches and forest patches left. But mostly it's, it burned pretty at pretty high severity.",wildfire
Grace Peven,[00:40:21:20],00:40:55:20,"but, but it's interesting because there's so many downed trees and standing dead trees that you think about how shady and forested this watershed used to be. And now it's hot and dry and exposed and kind of unforgiving in that way. and I think a lot about when I'm up here that I'll probably, I'll never see what this watershed used to look like just over 20 years ago before the fire.",wildfire
Grace Peven,[00:40:55:22],00:41:22:00,"It was a completely different place. And, and in one fire, it's it changed its character completely. but for also for that reason, these springs are easier to find in that way because they're more part of this more exposed matrix now. Think they would have been they would have been tough to spot with with thick forests and dense forests.",wildfire
Grace Peven,[00:41:22:02],00:41:53:16,"How it used to be in pioneer, but yeah, pioneer flows into big creek and and it we're about Taylor is about seven miles six or seven miles up from the confluence of of the Middle Fork. so big creek then flows into the middle fork of the Salmon River and goes through it kind of marks the entrance to the impassable canyon on the middle fork where the trail stops and really sheer cliffs come up.",water
Grace Peven,[00:41:53:16],00:42:23:22,"It's one of the deepest canyons in North America. and then the Middle Fork flows into the main salmon river, and then eventually the Lower Salmon River and the Snake River and into the Columbia and then into the ocean. So we're just in this tiny part of this huge basin, huge watershed. but it's all connected. It's where the springs are, where our water begins.",water
Grace Peven,[00:42:24:00],00:42:36:19,For so much of Idaho and Washington State and the whole Columbia River Basin.,water
Jack Kredell,[00:42:36:21],00:42:47:11,Do you think the changed environmental conditions post-fire have affected the the flow of springs?,
Grace Peven,[00:42:47:13],00:43:21:11,"That's a good question. I know that there's been research done on how fires affected, creeks and streams, but not necessarily, not necessarily springs that I know of. but it's definitely fire From what I've observed, fire usually burns hotter around springs because there's more vegetation growth around springs, but then it recovers more quickly because it has that consistent source of of water.",wildfire
Grace Peven,[00:43:21:11],00:44:01:05,"So vegetation recovers more quickly. It's more resilient to fire because of that water source and higher water content in the vegetation to. But it's you know, fire can sometimes change the plant community within within watershed. so it's possible that maybe we're seeing different vegetation structure and dynamics Post-Fire but yeah, that's, that's hard to say. I don't, I don't know exactly how much these springs have changed.",wildfire
Grace Peven,[00:44:01:11],00:44:34:09,"I know I've noticed in some of, some of the springs at lower elevation that I've been studying, I've noticed that within the spring footprint there, standing dead conifers. And that's really interesting to me because they're doug firs and that's not where you typically that's not a hospitable environment for doug firs within a wetted basically a wetland, a spring footprint that's not where you typically see them grow.",growth
Grace Peven,[00:44:34:09],00:45:01:00,"So that makes me think that something after the fire changed the path, the flow path of the springs, or maybe those springs used to be in a different location, like there is some something happening there that, that I don't think that water used to be there because the Doug Firs wouldn't have been able to survive.",wildfire