speaker,timestamp,End Time,words,tags
Jack Kredell,[00:28:06:22],00:28:08:07,I know.,
Janet Pope,[00:28:08:09],00:28:28:07,"I know. I basically mean, it's crazy. I mean, I don't know how these people sometimes they don't know what to do with me. You know, you're right. As I was always saying, What? We're going to do this don't want to do this, you know, So and they always take good care of me and they're always very respectful of me.",
Janet Pope,[00:28:28:07],00:28:52:13,"And they know I want to be part of things. And there's long like when I don't know what's going on with Taylor. And then I get real worried because we always need a good maintenance person here and we always need somebody to watch it all winter long. And it's hard to find those people. And there's always been budget cuts and I've always freaked out and panicked and you know, what can we do?",
Janet Pope,[00:28:52:13],00:28:54:08,So that's why we started that endowment.,
Jack Kredell,[00:28:54:08],00:28:59:13,So I think Andrew is pretty good.,
Janet Pope,[00:28:59:15],00:29:00:02,What is.,
Jack Kredell,[00:29:00:03],00:29:02:07,It? Are you happy with Andrew?,
Janet Pope,[00:29:02:16],00:29:43:00,"God, yeah, me too. God, Yeah. What I think we need right now, I have. Look what I think would be good for Taylor right now. And I've always been on the planning committee itself of I have some good ideas and they had a really good coordinator last year. And that's what I think we need right now. We need a, educator, a professor, professor type coordinator that can organize the research in here, whether it's an undergrad or graduate, bring in the government agencies and organize it.",government
Janet Pope,[00:29:43:00],00:30:12:02,"So there's always a project going on in here. And what the good part about that is that when you bring the undergrads in, they can always be part of that project and they can use them to go. Like I said before, I'll go up the stream with them and learn from those projects. And I think we're at a stage where we need to get a little more organized again, and I'm always the first one to to build the flowchart.",water
Janet Pope,[00:30:12:04],00:30:24:12,"Let's do it. You know, you can't. I'm always been encouraged with what they do on here. That was Teresa last year. You didn't know her.",
Jack Kredell,[00:30:24:14],00:30:25:21,I'm not. Theresa's on that.,
Janet Pope,[00:30:26:05],00:30:28:03,we did that before. We talked about that before.,
Jack Kredell,[00:30:28:03],00:30:29:14,I love Theresa.,
Janet Pope,[00:30:29:16],00:30:31:00,Do you know what I'm trying to say?,
Jack Kredell,[00:30:31:02],00:30:31:14,"Yeah, I do.",
Janet Pope,[00:30:31:18],00:30:35:16,Yeah. Just. I don't know what their plans are and all.,
Jack Kredell,[00:30:35:18],00:30:38:20,I know it's always been big to me.,
Janet Pope,[00:30:38:22],00:31:00:00,"You know? But I literally last two years ago, when Theresa, we we literally did have a flowchart. I was and I gave money for I was the grad student from to come to them to come and they would filter out projects and made sense to me. But then Theresa ended up leaving so.",